{
  "$schema": "https://json-schema.org/draft/2020-12/schema",
  "$id": "https://raw.githubusercontent.com/FinalForEach/Cosmic-Reach-Localization/master/assets/base/lang/odd-tips.schema.json",
  "title": "Cosmic Reach language (odd tips)",
  "description": "FinalForEach's Cosmic Reach game localization language schema for odd-tips.json",
  "type": "object",
  "additionalProperties": false,
  "__HOW_TO_ADD_PROPERTY__": "First, copy-paste a previous property ({type: 'string'} etc.), then change its key. Then update the minProperties field below to match the total count of the defined properties. (e.g. add 1 if you add 1 text etc.)",
  "__SCHEMA_DOCS__": "https://json-schema.org/understanding-json-schema/reference",
  "minProperties": 11,
  "properties": {
    "$schema": {
      "type": "string",
      "description": "Special property defining this schema as the schema of the language, e.g. should be same to the root $id property. Since this field does count to the total root minProperties property, it is required.",
      "const": "https://raw.githubusercontent.com/FinalForEach/Cosmic-Reach-Localization/master/assets/base/lang/odd-tips.schema.json"
    },
    "OddTip1": {
      "type": "string"
    },
    "OddTip2": {
      "type": "string"
    },
    "OddTip3": {
      "type": "string"
    },
    "OddTip4": {
      "type": "string"
    },
    "OddTip5": {
      "type": "string"
    },
    "OddTip6": {
      "type": "string"
    },
    "OddTip7": {
      "type": "string"
    },
    "OddTip8": {
      "type": "string"
    },
    "OddTip9": {
      "type": "string"
    },
    "OddTip10": {
      "type": "string"
    },
    "OddTip11": {
      "type": "string"
    }
  }
}
