{
    "OddTip1": "Kalemljenje stanica...",
    "OddTip2": "Inkubiranje...",
    "OddTip3": "Žrtvovanje subjekata...",
    "OddTip4": "Brojanje ovaca...",
    "OddTip5": "Odbacivanje mrtvog tkiva...",
    "OddTip6": "Skupljanje matičnih stanica...",
    "OddTip7": "Skupljanje \"donacija\" organa...",
    "OddTip8": "Promatranje tricefalusa...",
    "OddTip9": "Ponavljanje proba...",
    "OddTip10": "Svrstavanje specimena...",
    "OddTip11": "Savjet: Ne možeš se boriti protiv entropije."
}
