{
    "OddTip1": "Potē šūnas...",
    "OddTip2": "Inkubē...",
    "OddTip3": "Upurē izmēģinājuma trusīšus...",
    "OddTip4": "Skaita aitas...",
    "OddTip5": "Utilizē satrupējušos audus...",
    "OddTip6": "Ievāc cilmes šūnas...",
    "OddTip7": "Ievāc orgānu \"donorus\"...",
    "OddTip8": "Pēta leviatānu...",
    "OddTip9": "Atkārto piegājienus...",
    "OddTip10": "Kategorizē īpatņus...",
    "OddTip11": "Knifs: Entropijai nepretosies."
}
