{
  "OddTip1": "Criando células...",
  "OddTip2": "Incubando...",
  "OddTip3": "Sacrificando cobaias...",
  "OddTip4": "Contando ovelhas...",
  "OddTip5": "Jogando fora tecido morto...",
  "OddTip6": "Colhendo células tronco...",
  "OddTip7": "Coletando \"doações\" de orgãos...",
  "OddTip8": "Observando tricéfalo...",
  "OddTip9": "Repetindo testes...",
  "OddTip10": "Categorizando espécies...",
  "OddTip11": "Dica: Você não pode lutar contra a entropia."
}
