{
  "OddTip1": "Naghúhugpóng ng mga síhay...",
  "OddTip2": "Naglumílimlím...",
  "OddTip3": "Hinahandóg ang mga sákop...",
  "OddTip4": "Nagbíbiláng ng túpa...",
  "OddTip5": "Tinátanggál ang mga nasawíng síhayan...",
  "OddTip6": "Umaáni ng mga púnungtangkáyang síhay...",
  "OddTip7": "Nagtitípon ng mga \"pinagkaloóbang\" tátag...",
  "OddTip8": "Pinagmámasdán ang matatlóng-úlo...",
  "OddTip9": "Inuúlit-úlit ang mga pagsúbok...",
  "OddTip10": "Nag-uúrí-urí ng mga lakdá...",
  "OddTip11": "Hiwátig: Hindî mo malalabánan ang malikusóg."
}
