{
  "OddTip1": "Transplanterer celler...",
  "OddTip2": "Inkuberer...",
  "OddTip3": "Ofrer forsøkspersoner...",
  "OddTip4": "Teller sauer...",
  "OddTip5": "Kasserer dødt vev...",
  "OddTip6": "Høster stamceller...",
  "OddTip7": "Samler organ\"donasjoner\"...",
  "OddTip8": "Observerer Tricephalous...",
  "OddTip9": "Gjentar prøvelser...",
  "OddTip10": "Kategoriserer eksemplarer...",
  "OddTip11": "Tips: Du kan ikke kjempe imot entropi."
}
