{
  "OddTip1": "Okulerar celler...",
  "OddTip2": "Inkuberar...",
  "OddTip3": "Offrar subjekt...",
  "OddTip4": "Räknar lamm...",
  "OddTip5": "Kasserar död vävnad...",
  "OddTip6": "Skördar stamceller...",
  "OddTip7": "Samlar organ \"donationer\"...",
  "OddTip8": "Observerar tricefalus...",
  "OddTip9": "Upprepar prov...",
  "OddTip10": "Kategoriserar provexemplar...",
  "OddTip11": "Tips: Du kan inte förhindra entropi."
}
