{
  "OddTip1": "Transplanterer celler...",
  "OddTip2": "Inkuberer...",
  "OddTip3": "Ofrar forsøkspersonar...",
  "OddTip4": "Tel sauer...",
  "OddTip5": "Kasserar dødt vev...",
  "OddTip6": "Haustar stamceller...",
  "OddTip7": "Samlar organ\"donasjonar\"...",
  "OddTip8": "Observerer Tricephalous...",
  "OddTip9": "Gjentek prøvelsar...",
  "OddTip10": "Kategoriserer eksemplar...",
  "OddTip11": "Tips: Du kan ikkje kjempa imot entropi."
}
