{
    "OddTip1": "Пресађивање ћелија...",
    "OddTip2": "Инкубирање...",
    "OddTip3": "Жртвовање поданика...",
    "OddTip4": "Бројање оваца...",
    "OddTip5": "Одбацивање мртвог ткива...",
    "OddTip6": "Прикупљање матичних ћелија...",
    "OddTip7": "Прикпуљање органских \"донација\"...",
    "OddTip8": "Гледање трикефалоса...",
    "OddTip9": "Понављање експеримената...",
    "OddTip10": "Категоризирање примерака...",
    "OddTip11": "Савет: Не можеш се борити против ентропије."
}
