{
  "OddTip1": "A enxertar células...",
  "OddTip2": "A incubar...",
  "OddTip3": "A sacrificar cobaias...",
  "OddTip4": "A contar ovelhas...",
  "OddTip5": "A descartar tecido morto...",
  "OddTip6": "A colher células-tronco...",
  "OddTip7": "A coletar \"doações\" de orgãos...",
  "OddTip8": "A observar tricéfalos...",
  "OddTip9": "A repetir ensaios...",
  "OddTip10": "A categorizar espécimes...",
  "OddTip11": "Dica: Não consegues lutar contra a entropia."
}
