{
    "OddTip1": "Grafting cells...",
    "OddTip2": "Incubating...",
    "OddTip3": "Sacrificing subjects...",
    "OddTip4": "Counting sheep...",
    "OddTip5": "Discarding deceased tissue...",
    "OddTip6": "Harvesting stem cells...",
    "OddTip7": "Collecting organ \"donations\"...",
    "OddTip8": "Observing tricephalous...",
    "OddTip9": "Repeating trials...",
    "OddTip10": "Categorizing specimens...",
    "OddTip11": "Tip: You cannot fight against entropy."
}
