{
  "OddTip1": "Sejtek oltása...",
  "OddTip2": "Inkubálás...",
  "OddTip3": "Alanyok feláldozása...",
  "OddTip4": "Bárányok számolása...",
  "OddTip5": "Elhullott szövetek eldobása...",
  "OddTip6": "Őssejtek betakarítása...",
  "OddTip7": "Szerv \"adományok\" gyűjtése...",
  "OddTip8": "Háromfejűek megfigyelése...",
  "OddTip9": "Próbák ismétlése...",
  "OddTip10": "Minták kategorizálása...",
  "OddTip11": "Tipp: Nem harcolhatsz az entrópia ellen."
}
