{
    "OddTip1": "세포를 이식하는 중...",
    "OddTip2": "배양중...",
    "OddTip3": "피험자를 희생시키는 중...",
    "OddTip4": "양을 세는중...",
    "OddTip5": "죽은 조직을 폐기하는 중...",
    "OddTip6": "줄기세포를 수확하는 중...",
    "OddTip7": "'기부'된 장기를 수집중...",
    "OddTip8": "머리 세개 달린 괴물을 관찰중...",
    "OddTip9": "실험을 반복하는 중...",
    "OddTip10": "표본을 분류하는 중...",
    "OddTip11": "팁: 엔트로피에는 저항할 수 없습니다."
}