{
    "OddTip1": "移植细胞...",
    "OddTip2": "孵化中...",
    "OddTip3": "牺牲实验对象...",
    "OddTip4": "数绵羊...",
    "OddTip5": "丢弃死亡组织...",
    "OddTip6": "收获干细胞...",
    "OddTip7": "收集器官'捐赠'...",
    "OddTip8": "观察三头畸形...",
    "OddTip9": "重复试验...",
    "OddTip10": "分类标本...",
    "OddTip11": "提示: 你无法对抗熵。"
}
