{
  "OddTip1": "Roubuji buňky...",
  "OddTip2": "Inkubuji...",
  "OddTip3": "Obětovávám předměty...",
  "OddTip4": "Počítám ovečky...",
  "OddTip5": "Odstraňuji mrtvou tkáň...",
  "OddTip6": "Sklízím kmenové buňky...",
  "OddTip7": "Sbírám \"darované\" orgány...",
  "OddTip8": "Pozoruji tricefal...",
  "OddTip9": "Opakuji zkoušky...",
  "OddTip10": "Rozřazuji vzorky...",
  "OddTip11": "Tip: Nelze bojovat proti entropii."
}
