{
 "OddTip1": "細胞を移植しています...",
 "OddTip2": "培養中です...",
 "OddTip3": "被験者を犠牲にしています...", 
 "OddTip4": "羊を数えています...",
 "OddTip5": "死亡した組織を廃棄しています...",
 "OddTip6": "幹細胞を収穫しています...",
 "OddTip7": "臓器の「寄付」を収集しています...",
 "OddTip8": "三頭体を観察しています...",
 "OddTip9": "実験を繰り返しています...",
 "OddTip10": "標本を分類しています...",
 "OddTip11": "ヒント: エントロピーには抗えません。" 
}
