{
  "OddTip1": "Rakkude siirdamine...",
  "OddTip2": "Inkubeerimine...",
  "OddTip3": "Ohvrite ohverdamine...",
  "OddTip4": "Lammaste lugemine...",
  "OddTip5": "Surnud kudeme 채raviskamine...",
  "OddTip6": "T체virakkude koristamine...",
  "OddTip7": "\"Elundidoonorluste\" korjamine...",
  "OddTip8": "Tricephalouse j채lgimine...",
  "OddTip9": "Katsete kordamine...",
  "OddTip10": "Eksemplaride kategoriseerimine...",
  "OddTip11": "Vihje: Entroopia vastu v천itlemine on kasutu."
}
