{
    "OddTip1": "Перасаджваем клеткі...",
    "OddTip2": "Інкубуем...",
    "OddTip3": "Жэртвуем суб'ектамі...",
    "OddTip4": "Лічым авечак...",
    "OddTip5": "Выкідваем мёртвую тканіну...",
    "OddTip6": "Збіраем ствалавыя клеткі...",
    "OddTip7": "Збіраем \"ахвяраванні\" органаў...",
    "OddTip8": "Глядзім на трыцэфала...",
    "OddTip9": "Паўтараем выпрабаванні...",
    "OddTip10": "Класіфікуем асобнікі...",
    "OddTip11": "Падказка: Ты не можаш змагацца з энтрапіяй."
}
