{
    "OddTip1": "Se atașează celule...",
    "OddTip2": "Se incubează...",
    "OddTip3": "Se sacrifică subiecții...",
    "OddTip4": "Se numără oi...",
    "OddTip5": "Se aruncă țesut mort...",
    "OddTip6": "Se recoltează celule stem...",
    "OddTip7": "Se colectează \"donații\" de organe...",
    "OddTip8": "Se observă tricefalul...",
    "OddTip9": "Se repetă probele...",
    "OddTip10": "Se categorisesc specimenele...",
    "OddTip11": "Tip: Nu poți lupta împotriva entropiei."
}
