{
    "OddTip1": "Greftante ĉelojn...",
    "OddTip2": "Kovanta...",
    "OddTip3": "Oferante temojn...",
    "OddTip4": "Nombri ŝafojn...",
    "OddTip5": "Forĵetante forpasintan teksaĵon...",
    "OddTip6": "Rikolti stamĉelojn...",
    "OddTip7": "Kolekti \"donacojn\" de organoj...",
    "OddTip8": "Observante persono kun tri kapoj...",
    "OddTip9": "Ripetantaj provoj...",
    "OddTip10": "Kategoriiganta specimenojn...",
    "OddTip11": "Konsileto: Vi ne povas batali kontraŭ entropio."
}
