{
  "OddTip1": "Κύτταρα εμβολιασμού...",
  "OddTip2": "Επώαση...",
  "OddTip3": "Θυσία θεμάτων...",
  "OddTip4": "Μετράω προβατάκια...",
  "OddTip5": "Απόρριψη νεκρού ιστού...",
  "OddTip6": "Συγκομιδή βλαστοκυττάρων...",
  "OddTip7": "Συλλογή οργάνων \"δωρεές\"...",
  "OddTip8": "Παρατηρώντας τρικέφαλο...",
  "OddTip9": "Επαναλαμβανόμενες δοκιμές...",
  "OddTip10": "Ταξινόμηση δειγμάτων...",
  "OddTip11": "Συμβουλή: Δεν μπορείτε να πολεμήσετε την εντροπία"
}
