{
  "OddTip1": "Grefftio celloedd...",
  "OddTip2": "Deori...",
  "OddTip3": "Aberthu pynciau...",
  "OddTip4": "Cyfrif defaid...",
  "OddTip5": "Gwaredu meinwe ymadawedig...",
  "OddTip6": "Cynaeafu b√¥n-gelloedd...",
  "OddTip7": "Casglu \"rhoddion\" organau...",
  "OddTip8": "Arsylwi tricephalous...",
  "OddTip9": "Treialon ailadroddus...",
  "OddTip10": "Categoreiddio sbesimenau...",
  "OddTip11": "Awgrym: Ni allwch ymladd yn erbyn entropi."
}
