{
    "OddTip1": "Poder celler...",
    "OddTip2": "Inkuberer...",
    "OddTip3": "Ofre undersåttere...",
    "OddTip4": "Tæller får...",
    "OddTip5": "Forkaster ødelagt væv...",
    "OddTip6": "Høster stamceller...",
    "OddTip7": "Samler organ\"donationer\"...",
    "OddTip8": "Iagttager tricephalous...",
    "OddTip9": "Gentager tests...",
    "OddTip10": "Kategoriserer organismer...",
    "OddTip11": "Tip: Kampen mod entropi er ikke en som du kan vinde.."
}
